### ISSUE TITLE
[BUG]: High CPU load, Linux, Connecting to PennMUSH

### ISSUE THREAD

**Issue by kaledin** [Nodens-/QMud#46]
### Summary

Downloaded the AppImage, ran on Fedora 43. Once connected to a world, I noticed the laptop fans ramping up, btop says that 4 out of 12 cores are at 30%, overall system CPU load went up to 6% (from 0.5%), all of this accounting to the QMUD process.
This only happens after you connect to a world no CPU load before connection

### Steps to reproduce

1. Open QMUD
2. Connect to a world

### Expected behavior

There shouldn't be any CPU load difference when disconnected/connected

### Actual behavior

.

### QMud version/commit

v10.10

### Platform

Linux

### Platform version

Fedora 43

### Logs / screenshots

<img width="1052" height="537" alt="Image" src="https://github.com/user-attachments/assets/1377571a-9cc3-4d5c-8fc1-fe86405cbd52" />

```shell

```

### Checklist

- [x] I searched existing issues and did not find a duplicate.

**Comment by Nodens-** [comment]
Hi. Having no CPU load difference when connected vs disconnected is actually impossible. Disconnected has no processing. Connected is processing incoming text and formatting/styling it, processing timers and triggers (regex matching depending on what the regex actually is can be expensive) and any potential scripts/plugins running (which can be heavy on their own; #8  will help a lot there but that's not done yet).

That said it, the load does sound quite high. On my system it is sitting at 0.5-0.6 with 5 muds open, plugins and heavy triggers.

A few questions.

1. Do you see this upon connecting only and then it drops or do you see it permanently after connecting?
2. Does disabling the scrollback buffer persistence feature (World Preferences->Output) remove the load?
3. Does it happen with one particular mud or in general?
4. Do you use any particular plugins or heavy regex triggers? Scripts?
5. Can you give me an example of a mud you're connecting to when you see this?

**Comment by kaledin** [comment]
Ok, this question is the culprit: "Does it happen with one particular mud or in general?"

I was trying it with my local PennMUSH installation on localhost. It is as if it is flooding PennMUSH with some connection requests, because not only QMUD is actively using the CPU, but also the netmush process CPU usage increases sharply.

And here is what the 'WHO' command on PennMUSH server prints when this is happening:

Player Name       Loc #    On For  Idle  Cmds Des  Host
Connecting...       #-1       20s   17s    1  20  localhost
Gin'tak             #19   21m  7s    0s    12  17 localhost
There is one player connected.

I tried connecting to other servers (remote ones), no issues. Maybe some issue with Penn, any clue?

P.S. Surely other clients like vanilla telnet or tf work just fine with my local server.

**Comment by Nodens-** [comment]
@kaledin is your local PennMUSH this https://github.com/pennmush/pennmush or some other fork? I need to reproduce it so I can see what's wrong.

Also did you use the latest version for this test?

**Comment by kaledin** [comment]
> [@kaledin](https://github.com/kaledin) is your local PennMUSH this https://github.com/pennmush/pennmush or some other fork?

-- yes
> 
> Also did you use the latest version for this test?

-- yes

**Comment by kaledin** [comment]
try trekmush.vineyard.haus 1701, it's the same one that I have locally

I tried QMud for MacOS, also 10.21, no problems

**Comment by kaledin** [comment]
Ok, I ran `tcpdump -i lo -nn -s0 port 1701` while connecting to localhost pennmush, I get floods of this:

```
19:22:35.584984 IP 127.0.0.1.1701 > 127.0.0.1.57792: Flags [P.], seq 6417688:6417694, ack 6414369, win 64, options [nop,nop,TS val 3005231970 ecr 4116905591], length 6
19:22:35.584993 IP 127.0.0.1.57792 > 127.0.0.1.1701: Flags [P.], seq 6414369:6414375, ack 6417694, win 160, options [nop,nop,TS val 4116905591 ecr 3005231970], length 6
19:22:35.584996 IP 127.0.0.1.1701 > 127.0.0.1.57792: Flags [P.], seq 6417694:6417700, ack 6414375, win 64, options [nop,nop,TS val 3005231970 ecr 4116905591], length 6
19:22:35.585004 IP 127.0.0.1.57792 > 127.0.0.1.1701: Flags [P.], seq 6414375:6414381, ack 6417700, win 160, options [nop,nop,TS val 4116905591 ecr 3005231970], length 6
19:22:35.585008 IP 127.0.0.1.1701 > 127.0.0.1.57792: Flags [P.], seq 6417700:6417706, ack 6414381, win 64, options [nop,nop,TS val 3005231970 ecr 4116905591], length 6
19:22:35.585016 IP 127.0.0.1.57792 > 127.0.0.1.1701: Flags [P.], seq 6414381:6414387, ack 6417706, win 160, options [nop,nop,TS val 4116905591 ecr 3005231970], length 6
```
...

**Comment by kaledin** [comment]
hexdump:
```
19:46:21.872197 IP 127.0.0.1.1701 > 127.0.0.1.56404: Flags [P.], seq 3488530:3488536, ack 3485211, win 64, options [nop,nop,TS val 1797119181 ecr 4240877505], length 6
	0x0000:  4500 003a cca7 4000 4006 7014 7f00 0001  E..:..@.@.p.....
	0x0010:  7f00 0001 06a5 dc54 edaa 6eec 8f4b 1d33  .......T..n..K.3
	0x0020:  8018 0040 fe2e 0000 0101 080a 6b1d dccd  ...@........k...
	0x0030:  fcc6 a7c1 fffb 03ff fd03                 ..........
19:46:21.872209 IP 127.0.0.1.56404 > 127.0.0.1.1701: Flags [P.], seq 3485211:3485217, ack 3488536, win 192, options [nop,nop,TS val 4240877505 ecr 1797119181], length 6
	0x0000:  4500 003a e871 4000 4006 544a 7f00 0001  E..:.q@.@.TJ....
	0x0010:  7f00 0001 dc54 06a5 8f4b 1d33 edaa 6ef2  .....T...K.3..n.
	0x0020:  8018 00c0 fe2e 0000 0101 080a fcc6 a7c1  ................
	0x0030:  6b1d dccd fffd 03ff fb03                 k.........
19:46:21.872214 IP 127.0.0.1.1701 > 127.0.0.1.56404: Flags [P.], seq 3488536:3488542, ack 3485217, win 64, options [nop,nop,TS val 1797119181 ecr 4240877505], length 6
	0x0000:  4500 003a cca8 4000 4006 7013 7f00 0001  E..:..@.@.p.....
	0x0010:  7f00 0001 06a5 dc54 edaa 6ef2 8f4b 1d39  .......T..n..K.9
	0x0020:  8018 0040 fe2e 0000 0101 080a 6b1d dccd  ...@........k...
	0x0030:  fcc6 a7c1 fffb 03ff fd03                 ..........
19:46:21.872226 IP 127.0.0.1.56404 > 127.0.0.1.1701: Flags [P.], seq 3485217:3485223, ack 3488542, win 192, options [nop,nop,TS val 4240877505 ecr 1797119181], length 6
	0x0000:  4500 003a e872 4000 4006 5449 7f00 0001  E..:.r@.@.TI....
	0x0010:  7f00 0001 dc54 06a5 8f4b 1d39 edaa 6ef8  .....T...K.9..n.
	0x0020:  8018 00c0 fe2e 0000 0101 080a fcc6 a7c1  ................
	0x0030:  6b1d dccd fffd 03ff fb03                 k.........
```
...

**Comment by Nodens-** [comment]
@kaledin Thank you very much! The dump is actually very helpful. This is a telnet option negotiation loop for SGA.
What happens here is `WILL` -> `DO` -> `WILL` -> `DO` repeatedly. That it doesn't happen on MacOS seems to be timing related. RFC1143 says that once an option is negotiated the client should stop replying to further attempts to negotiate it again exactly because it may result in a loop in some cases. QMud currently does not honor this (original MUSHclient did) because it breaks a lot of MUxx out there doing copyover style reboot to bring code changes in, that renegotiate after the new binary has loaded and has reattached the socket (client has no way to know that this has happened so it has to answer new negotiation, otherwise every option will be off or in a weird broken state). I had relaxed this on my MUSHclientx64 port as well and I had never actually hit a case resulting in an actual loop like this. Until now.

 Next version will add a toggle for this to suppress further attempts at telnet option renegotiation once an option has been negotiated. It'll be per in `World preferences` -> `Connecting`, under the `Connect Text` box. named `Only negotiate telnet options once` - Default off. New version should be up in half an hour or so.
